{
  "event_id": "0197a001-0000-7000-8000-000000000007",
  "event_name": "order_cancelled",
  "event_version": 1,
  "user_id": "user_000001",
  "anonymous_id": "anon_user_000001",
  "session_id": "session_user_000001_7",
  "experiment_id": "new_ranking_algorithm",
  "variant_id": "treatment",
  "event_timestamp": "2026-08-06T10:03:00Z",
  "sent_timestamp": "2026-08-06T10:03:00.020Z",
  "received_timestamp": "2026-08-06T10:03:00.200Z",
  "source": "ios",
  "attributes": {
    "order_id": "order_user_000001_7",
    "actor": "customer",
    "reason": "changed_mind"
  }
}
