{
  "event_id": "0197a001-0000-7000-8000-000000000004",
  "event_name": "item_added",
  "event_version": 1,
  "user_id": "user_000001",
  "anonymous_id": "anon_user_000001",
  "session_id": "session_user_000001_7",
  "experiment_id": "new_ranking_algorithm",
  "variant_id": "treatment",
  "event_timestamp": "2026-08-06T10:00:12Z",
  "sent_timestamp": "2026-08-06T10:00:12.020Z",
  "received_timestamp": "2026-08-06T10:00:12.200Z",
  "source": "ios",
  "attributes": {
    "restaurant_id": "restaurant_17",
    "item_id": "item_42",
    "price": 74.5
  }
}
