{
  "event_id": "0197a001-0000-7000-8000-000000000003",
  "event_name": "restaurant_viewed",
  "event_version": 1,
  "user_id": "user_000001",
  "anonymous_id": "anon_user_000001",
  "session_id": "session_user_000001_7",
  "experiment_id": "new_ranking_algorithm",
  "variant_id": "treatment",
  "event_timestamp": "2026-08-06T10:00:04Z",
  "sent_timestamp": "2026-08-06T10:00:04.020Z",
  "received_timestamp": "2026-08-06T10:00:04.200Z",
  "source": "ios",
  "attributes": {
    "restaurant_id": "restaurant_17",
    "rank": 2,
    "query_id": "query_user_000001_7"
  }
}
