{
  "event_id": "0197a001-0000-7000-8000-000000000002",
  "event_name": "experiment_exposed",
  "event_version": 1,
  "user_id": "user_000001",
  "anonymous_id": "anon_user_000001",
  "session_id": "session_user_000001_7",
  "experiment_id": "new_ranking_algorithm",
  "variant_id": "treatment",
  "event_timestamp": "2026-08-06T10:00:01Z",
  "sent_timestamp": "2026-08-06T10:00:01.020Z",
  "received_timestamp": "2026-08-06T10:00:01.200Z",
  "source": "ios",
  "attributes": {
    "feature_version": "ranking-v1",
    "surface": "restaurant_feed"
  }
}
