{
  "event_id": "0197a001-0000-7000-8000-000000000001",
  "event_name": "experiment_assigned",
  "event_version": 1,
  "user_id": "user_000001",
  "anonymous_id": "anon_user_000001",
  "session_id": "session_user_000001_7",
  "experiment_id": "new_ranking_algorithm",
  "variant_id": "treatment",
  "event_timestamp": "2026-08-06T10:00:00Z",
  "sent_timestamp": "2026-08-06T10:00:00.020Z",
  "received_timestamp": "2026-08-06T10:00:00.200Z",
  "source": "ios",
  "attributes": {
    "bucket": 312,
    "allocation_version": 1,
    "assignment_reason": "deterministic_bucket"
  }
}
